----------------------------------------------------------------------------
CrystalDiskInfo 8.8.9 (C) 2008-2020 hiyohiyo
                                Crystal Dew World: https://crystalmark.info/
----------------------------------------------------------------------------

    OS : Windows 10 Professional [10.0 Build 19042] (x64)
  Date : 2021/04/09 12:37:09

-- Controller Map ----------------------------------------------------------
 + Standardowy kontroler SATA AHCI [ATA]
   - ADATA SSD SX900 512GB-DL2
   - WDC WD40EZRZ-00GXCB0
   - PLDS DVD+-RW DH-16ACS
 - Kontroler miejsc do magazynowania firmy Microsoft [SCSI]

-- Disk List ---------------------------------------------------------------
 (01) ADATA SSD SX900 512GB-DL2 : 512,1 GB [0/0/0, pd1] - sf
 (02) WDC WD40EZRZ-00GXCB0 : 4000,7 GB [1/0/0, pd1]

----------------------------------------------------------------------------
 (01) ADATA SSD SX900 512GB-DL2
----------------------------------------------------------------------------
           Model : ADATA SSD SX900 512GB-DL2
        Firmware : 5.8.2
   Serial Number : 7E4620002217
       Disk Size : 512,1 GB (8,4/137,4/512,1/512,1)
     Buffer Size : Unknown
     Queue Depth : 32
    # of Sectors : 1000215216
   Rotation Rate : ---- (SSD)
       Interface : Serial ATA
   Major Version : ATA8-ACS
   Minor Version : ACS-2 Revision 3
   Transfer Mode : SATA/600 | SATA/600
  Power On Hours : 44998 hours
  Power On Count : 257 count
      Host Reads : 218928 GB
     Host Writes : 539164 GB
     Temperature : 33 C (91 F)
   Health Status : Good (76 %)
        Features : S.M.A.R.T., APM, NCQ, TRIM
       APM Level : 00FEh [ON]
       AAM Level : ----
    Drive Letter : C:

-- S.M.A.R.T. --------------------------------------------------------------
ID Cur Wor Thr Raw Values (7) Attribute Name
01 _95 _95 _50 00000000D27448 Raw Read Error Rate
05 100 100 __3 00000000000000 Retired Block Count
09 _49 _49 __0 264F800000AFC6 Power-On Hours
0C 100 100 __0 00000000000101 Power Cycle Count
AB 100 100 __0 00000000000000 Program Fail Count
AC 100 100 __0 00000000000000 Erase Fail Count
AE __0 __0 __0 000000000000AB Unexpected Power Loss Count
B1 __0 __0 __0 0000000000004C Wear Range Delta
B5 100 100 __0 00000000000000 Program Fail Count
B6 100 100 __0 00000000000000 Erase Fail Count
BB 100 100 __0 00000000000000 Reported Uncorrectable Errors
C2 _33 _87 __0 0000EB00570021 Temperature
C3 120 120 __0 00000000D27448 On-the-Fly ECC Uncorrectable Error Count
C4 100 100 __3 00000000000000 Reallocation Event Count
C9 120 120 __0 00000000D27448 Uncorrectable Soft Read Error Rate
CC 120 120 __0 00000000D27448 Soft ECC Correction Rate
E6 100 100 __0 00000000000064 Drive Life Protection Status
E7 _76 _76 _10 00001B00000000 SSD Life Left
E9 __0 __0 __0 0000000005B95E Vendor Specific
EA __0 __0 __0 00000000083A1C Vendor Specific
F1 __0 __0 __0 00000000083A1C Lifetime Writes from Host
F2 __0 __0 __0 00000000035730 Lifetime Reads from Host

-- IDENTIFY_DEVICE ---------------------------------------------------------
        0    1    2    3    4    5    6    7    8    9
000: 0C5A 3FFF 738C 0010 0000 0000 003F 0000 0000 0000
010: 3745 3436 3230 3030 3232 3137 2020 2020 2020 2020
020: 0000 0000 0004 352E 382E 3220 2020 4144 4154 4120
030: 5353 4420 5358 3930 3020 3531 3247 422D 444C 3220
040: 2020 2020 2020 2020 2020 2020 2020 8001 4000 2F00
050: 4001 0200 0200 0007 3FFF 0010 003F FC10 00FB 0101
060: FFFF 0FFF 0000 0007 0003 0078 0078 0078 0078 0F08
070: 0000 0000 0000 0000 0000 001F 950E 0006 004C 0040
080: 01FC 0110 742B 7569 6163 7429 B449 6163 207F 0003
090: 0003 00FE FFFE 0000 0000 0000 0000 0000 0000 0000
100: 12B0 3B9E 0000 0000 0000 0001 4000 0000 5707 C180
110: 0008 B8FF 0000 0000 0000 0000 0000 0000 0000 405A
120: 4018 0000 0000 0000 0000 0000 0000 0000 0029 0000
130: 0000 0000 0000 0000 0000 0000 0000 0000 0000 0000
140: 0000 0000 0000 0000 0000 0000 0000 0000 0000 0000
150: 0000 0000 0000 0000 0000 0000 0000 0000 0000 0000
160: 0000 0000 0000 0000 0000 0000 0000 0000 0000 0001
170: 0000 0000 0000 0000 0000 0000 0000 0000 0000 0000
180: 0000 0000 0000 0000 0000 0000 0000 0000 0000 0000
190: 0000 0000 0000 0000 0000 0000 0000 0000 0000 0000
200: 0000 0000 0000 0000 0000 0000 0025 0000 0000 4000
210: 0000 0000 0100 0000 0000 0000 0000 0001 0000 0000
220: 0000 0000 103F 0000 0000 0000 0000 0000 0000 0000
230: 12B0 3B9E 0000 0000 0002 0400 0000 0000 0000 0000
240: 0000 0000 0000 0000 0000 0000 0000 0000 0000 0000
250: 0000 0000 0000 0000 0000 90A5

-- SMART_READ_DATA ---------------------------------------------------------
     +0 +1 +2 +3 +4 +5 +6 +7 +8 +9 +A +B +C +D +E +F
000: 0A 00 01 32 00 5F 5F 48 74 D2 00 00 00 00 05 33
010: 00 64 64 00 00 00 00 00 00 00 09 32 00 31 31 C6
020: AF 00 00 80 4F 26 0C 32 00 64 64 01 01 00 00 00
030: 00 00 AB 0A 00 64 64 00 00 00 00 00 00 00 AC 32
040: 00 64 64 00 00 00 00 00 00 00 AE 30 00 00 00 AB
050: 00 00 00 00 00 00 B1 00 00 00 00 4C 00 00 00 00
060: 00 00 B5 0A 00 64 64 00 00 00 00 00 00 00 B6 32
070: 00 64 64 00 00 00 00 00 00 00 BB 12 00 64 64 00
080: 00 00 00 00 00 00 C2 22 00 21 57 21 00 57 00 EB
090: 00 00 C3 1C 00 78 78 48 74 D2 00 00 00 00 C4 33
0A0: 00 64 64 00 00 00 00 00 00 00 C9 1C 00 78 78 48
0B0: 74 D2 00 00 00 00 CC 1C 00 78 78 48 74 D2 00 00
0C0: 00 00 E6 13 00 64 64 64 00 00 00 00 00 00 E7 13
0D0: 00 4C 4C 00 00 00 00 1B 00 00 E9 32 00 00 00 5E
0E0: B9 05 00 00 00 00 EA 32 00 00 00 1C 3A 08 00 00
0F0: 00 00 F1 32 00 00 00 1C 3A 08 00 00 00 00 F2 32
100: 00 00 00 30 57 03 00 00 00 00 00 00 00 00 00 00
110: 00 00 00 00 00 00 00 00 00 00 00 00 00 00 00 00
120: 00 00 00 00 00 00 00 00 00 00 00 00 00 00 00 00
130: 00 00 00 00 00 00 00 00 00 00 00 00 00 00 00 00
140: 00 00 00 00 00 00 00 00 00 00 00 00 00 00 00 00
150: 00 00 00 00 00 00 00 00 00 00 00 00 00 00 00 00
160: 00 00 00 00 00 00 00 00 00 00 02 00 00 00 00 7D
170: 03 00 01 00 01 30 02 00 00 00 00 00 00 00 00 00
180: 00 00 00 00 00 00 00 00 00 00 00 00 00 00 00 00
190: 00 00 00 00 00 00 00 00 00 00 00 00 00 00 00 00
1A0: 00 00 00 00 00 00 00 00 00 00 00 00 00 00 00 00
1B0: 00 00 00 00 00 00 00 00 00 00 00 00 00 00 00 00
1C0: 00 00 00 00 00 00 00 00 00 00 00 00 00 00 00 00
1D0: 00 00 00 00 00 00 00 00 00 00 00 00 00 00 00 00
1E0: 00 00 00 00 00 00 00 00 00 00 00 00 00 00 00 00
1F0: 00 00 00 00 00 00 00 00 00 00 00 00 00 00 00 E7

-- SMART_READ_THRESHOLD ----------------------------------------------------
     +0 +1 +2 +3 +4 +5 +6 +7 +8 +9 +A +B +C +D +E +F
000: 0A 00 01 32 00 00 00 00 00 00 00 00 00 00 05 03
010: 00 00 00 00 00 00 00 00 00 00 09 00 00 00 00 00
020: 00 00 00 00 00 00 0C 00 00 00 00 00 00 00 00 00
030: 00 00 AB 00 00 00 00 00 00 00 00 00 00 00 AC 00
040: 00 00 00 00 00 00 00 00 00 00 AE 00 00 00 00 00
050: 00 00 00 00 00 00 B1 00 00 00 00 00 00 00 00 00
060: 00 00 B5 00 00 00 00 00 00 00 00 00 00 00 B6 00
070: 00 00 00 00 00 00 00 00 00 00 BB 00 00 00 00 00
080: 00 00 00 00 00 00 C2 00 00 00 00 00 00 00 00 00
090: 00 00 C3 00 00 00 00 00 00 00 00 00 00 00 C4 03
0A0: 00 00 00 00 00 00 00 00 00 00 C9 00 00 00 00 00
0B0: 00 00 00 00 00 00 CC 00 00 00 00 00 00 00 00 00
0C0: 00 00 E6 00 00 00 00 00 00 00 00 00 00 00 E7 0A
0D0: 00 00 00 00 00 00 00 00 00 00 E9 00 00 00 00 00
0E0: 00 00 00 00 00 00 EA 00 00 00 00 00 00 00 00 00
0F0: 00 00 F1 00 00 00 00 00 00 00 00 00 00 00 F2 00
100: 00 00 00 00 00 00 00 00 00 00 00 00 00 00 00 00
110: 00 00 00 00 00 00 00 00 00 00 00 00 00 00 00 00
120: 00 00 00 00 00 00 00 00 00 00 00 00 00 00 00 00
130: 00 00 00 00 00 00 00 00 00 00 00 00 00 00 00 00
140: 00 00 00 00 00 00 00 00 00 00 00 00 00 00 00 00
150: 00 00 00 00 00 00 00 00 00 00 00 00 00 00 00 00
160: 00 00 00 00 00 00 00 00 00 00 00 00 00 00 00 00
170: 00 00 00 00 00 00 00 00 00 00 00 00 00 00 00 00
180: 00 00 00 00 00 00 00 00 00 00 00 00 00 00 00 00
190: 00 00 00 00 00 00 00 00 00 00 00 00 00 00 00 00
1A0: 00 00 00 00 00 00 00 00 00 00 00 00 00 00 00 00
1B0: 00 00 00 00 00 00 00 00 00 00 00 00 00 00 00 00
1C0: 00 00 00 00 00 00 00 00 00 00 00 00 00 00 00 00
1D0: 00 00 00 00 00 00 00 00 00 00 00 00 00 00 00 00
1E0: 00 00 00 00 00 00 00 00 00 00 00 00 00 00 00 00
1F0: 00 00 00 00 00 00 00 00 00 00 00 00 00 00 00 5C

----------------------------------------------------------------------------
 (02) WDC WD40EZRZ-00GXCB0
----------------------------------------------------------------------------
           Model : WDC WD40EZRZ-00GXCB0
        Firmware : 80.00A80
   Serial Number : WD-WCC7K6AKHC8V
       Disk Size : 4000,7 GB (8,4/137,4/4000,7/4000,7)
     Buffer Size : Unknown
     Queue Depth : 32
    # of Sectors : 7814037168
   Rotation Rate : 5400 RPM
       Interface : Serial ATA
   Major Version : ACS-3
   Minor Version : ACS-3 Revision 5
   Transfer Mode : SATA/300 | SATA/600
  Power On Hours : 339 hours
  Power On Count : 99 count
     Temperature : 31 C (87 F)
   Health Status : Good
        Features : S.M.A.R.T., NCQ
       APM Level : ----
       AAM Level : ----
    Drive Letter : D:

-- S.M.A.R.T. --------------------------------------------------------------
ID Cur Wor Thr RawValues(6) Attribute Name
01 200 200 _51 000000000000 Read Error Rate
03 172 154 _21 0000000018EF Spin-Up Time
04 100 100 __0 0000000000C6 Start/Stop Count
05 200 200 140 000000000000 Reallocated Sectors Count
07 100 253 __0 000000000000 Seek Error Rate
09 100 100 __0 000000000153 Power-On Hours
0A 100 100 __0 000000000000 Spin Retry Count
0B 100 253 __0 000000000000 Recalibration Retries
0C 100 100 __0 000000000063 Power Cycle Count
C0 200 200 __0 000000000016 Power-off Retract Count
C1 200 200 __0 000000000542 Load/Unload Cycle Count
C2 119 109 __0 00000000001F Temperature
C4 200 200 __0 000000000000 Reallocation Event Count
C5 200 200 __0 000000000000 Current Pending Sector Count
C6 100 253 __0 000000000000 Uncorrectable Sector Count
C7 200 164 __0 00000000006D UltraDMA CRC Error Count
C8 100 253 __0 000000000000 Write Error Rate

-- IDENTIFY_DEVICE ---------------------------------------------------------
        0    1    2    3    4    5    6    7    8    9
000: 427A 3FFF C837 0010 0000 0000 003F 0000 0000 0000
010: 2020 2020 2057 442D 5743 4337 4B36 414B 4843 3856
020: 0000 0000 0000 3830 2E30 3041 3830 5744 4320 5744
030: 3430 455A 525A 2D30 3047 5843 4230 2020 2020 2020
040: 2020 2020 2020 2020 2020 2020 2020 8010 4000 2F00
050: 4001 0000 0000 0006 3FFF 0010 003F FC10 00FB 0110
060: FFFF 0FFF 0000 0007 0003 0078 0078 0078 0078 0D00
070: 0000 0000 0000 0000 0000 001F 970E 0004 004C 0040
080: 07FE 006D 746B 7D61 4123 7469 BC41 4123 207F 80F6
090: 80F6 0000 FFFE 0000 0000 0000 0000 0000 0000 0000
100: BEB0 D1C0 0001 0000 0000 0000 6003 0000 5001 4EE2
110: 63FF 6262 0000 0000 0000 0000 0000 0000 0000 401C
120: 401C 0000 0000 0000 0000 0000 0000 0000 0029 0000
130: 0000 0000 0000 0000 0000 0000 0000 0000 0000 0000
140: 0000 0000 0004 0000 0000 0000 0000 0000 0000 0000
150: 0000 0000 0000 0000 0000 0000 0000 0000 0000 0000
160: 0000 0000 0000 0000 0000 0000 0000 0000 0002 0000
170: 0000 0000 0000 0000 0000 0000 0000 0000 0000 0000
180: 0000 0000 0000 0000 0000 0000 0000 0000 0000 0000
190: 0000 0000 0000 0000 0000 0000 0000 0000 0000 0000
200: 0000 0000 0000 0000 0000 0000 3035 0000 0000 4000
210: 0000 0000 0000 0000 0000 0000 0000 1518 0000 0000
220: 0000 0000 107E 0000 0000 0000 0000 0000 0000 0000
230: 0000 0000 0000 0000 0001 2800 0000 0000 0000 0000
240: 0000 0000 0000 0000 0000 0000 0000 0000 0000 0000
250: 0000 0000 0000 0000 0000 14A5

-- SMART_READ_DATA ---------------------------------------------------------
     +0 +1 +2 +3 +4 +5 +6 +7 +8 +9 +A +B +C +D +E +F
000: 10 00 01 2F 00 C8 C8 00 00 00 00 00 00 00 03 27
010: 00 AC 9A EF 18 00 00 00 00 00 04 32 00 64 64 C6
020: 00 00 00 00 00 00 05 33 00 C8 C8 00 00 00 00 00
030: 00 00 07 2E 00 64 FD 00 00 00 00 00 00 00 09 32
040: 00 64 64 53 01 00 00 00 00 00 0A 32 00 64 64 00
050: 00 00 00 00 00 00 0B 32 00 64 FD 00 00 00 00 00
060: 00 00 0C 32 00 64 64 63 00 00 00 00 00 00 C0 32
070: 00 C8 C8 16 00 00 00 00 00 00 C1 32 00 C8 C8 42
080: 05 00 00 00 00 00 C2 22 00 77 6D 1F 00 00 00 00
090: 00 00 C4 32 00 C8 C8 00 00 00 00 00 00 00 C5 32
0A0: 00 C8 C8 00 00 00 00 00 00 00 C6 30 00 64 FD 00
0B0: 00 00 00 00 00 00 C7 32 00 C8 A4 6D 00 00 00 00
0C0: 00 00 C8 08 00 64 FD 00 00 00 00 00 00 00 00 00
0D0: 00 00 00 00 00 00 00 00 00 00 00 00 00 00 00 00
0E0: 00 00 00 00 00 00 00 00 00 00 00 00 00 00 00 00
0F0: 00 00 00 00 00 00 00 00 00 00 00 00 00 00 00 00
100: 00 00 00 00 00 00 00 00 00 00 00 00 00 00 00 00
110: 00 00 00 00 00 00 00 00 00 00 00 00 00 00 00 00
120: 00 00 00 00 00 00 00 00 00 00 00 00 00 00 00 00
130: 00 00 00 00 00 00 00 00 00 00 00 00 00 00 00 00
140: 00 00 00 00 00 00 00 00 00 00 00 00 00 00 00 00
150: 00 00 00 00 00 00 00 00 00 00 00 00 00 00 00 00
160: 00 00 00 00 00 00 00 00 00 00 80 00 C8 AF 01 7B
170: 03 00 01 00 02 FF 05 DE 01 00 00 00 00 00 00 00
180: 00 00 01 06 00 00 00 00 00 00 00 00 00 00 00 00
190: 00 00 00 00 00 00 00 00 00 00 00 00 00 00 00 00
1A0: 00 00 00 00 00 00 00 00 00 00 00 00 00 00 00 00
1B0: 00 00 00 00 00 00 00 00 00 00 00 00 00 00 00 00
1C0: 00 00 00 00 00 00 00 00 00 00 00 00 00 00 00 00
1D0: 00 00 00 00 00 00 00 00 00 00 00 00 00 00 00 00
1E0: 00 00 00 00 00 00 00 00 00 00 00 00 00 00 00 00
1F0: 00 00 00 00 00 00 00 00 00 00 00 00 00 00 00 22

-- SMART_READ_THRESHOLD ----------------------------------------------------
     +0 +1 +2 +3 +4 +5 +6 +7 +8 +9 +A +B +C +D +E +F
000: 10 00 01 33 C8 C8 C8 C8 C8 C8 00 00 00 00 03 15
010: 00 00 00 00 00 00 00 00 00 00 04 00 00 00 00 00
020: 00 00 00 00 00 00 05 8C 00 00 00 00 00 00 00 00
030: 00 00 07 00 64 64 64 64 64 64 00 00 00 00 09 00
040: 00 00 00 00 00 00 00 00 00 00 0A 00 00 00 00 00
050: 00 00 00 00 00 00 0B 00 00 00 00 00 00 00 00 00
060: 00 00 0C 00 00 00 00 00 00 00 00 00 00 00 C0 00
070: 00 00 00 00 00 00 00 00 00 00 C1 00 00 00 00 00
080: 00 00 00 00 00 00 C2 00 00 00 00 00 00 00 00 00
090: 00 00 C4 00 00 00 00 00 00 00 00 00 00 00 C5 00
0A0: 00 00 00 00 00 00 00 00 00 00 C6 00 00 00 00 00
0B0: 00 00 00 00 00 00 C7 00 00 00 00 00 00 00 00 00
0C0: 00 00 C8 00 00 00 00 00 00 00 00 00 00 00 00 00
0D0: 00 00 00 00 00 00 00 00 00 00 00 00 00 00 00 00
0E0: 00 00 00 00 00 00 00 00 00 00 00 00 00 00 00 00
0F0: 00 00 00 00 00 00 00 00 00 00 00 00 00 00 00 00
100: 00 00 00 00 00 00 00 00 00 00 00 00 00 00 00 00
110: 00 00 00 00 00 00 00 00 00 00 00 00 00 00 00 00
120: 00 00 00 00 00 00 00 00 00 00 00 00 00 00 00 00
130: 00 00 00 00 00 00 00 00 00 00 00 00 00 00 00 00
140: 00 00 00 00 00 00 00 00 00 00 00 00 00 00 00 00
150: 00 00 00 00 00 00 00 00 00 00 00 00 00 00 00 00
160: 00 00 00 00 00 00 00 00 00 00 80 00 C8 AF 01 7B
170: 03 00 01 00 02 FF 05 DE 01 00 00 00 00 00 00 00
180: 00 00 01 06 00 00 00 00 00 00 00 00 00 00 00 00
190: 00 00 00 00 00 00 00 00 00 00 00 00 00 00 00 00
1A0: 00 00 00 00 00 00 00 00 00 00 00 00 00 00 00 00
1B0: 00 00 00 00 00 00 00 00 00 00 00 00 00 00 00 00
1C0: 00 00 00 00 00 00 00 00 00 00 00 00 00 00 00 00
1D0: 00 00 00 00 00 00 00 00 00 00 00 00 00 00 00 00
1E0: 00 00 00 00 00 00 00 00 00 00 00 00 00 00 00 00
1F0: 00 00 00 00 00 00 00 00 00 00 00 00 00 00 00 52

